{
  "schema_version": 1,
  "task_id": "10000000-0000-4000-8000-000000000001",
  "tenant_id": "fixture-tenant",
  "decision_id": "20000000-0000-4000-8000-000000000001",
  "run_id": "30000000-0000-4000-8000-000000000001",
  "assignee_id": "fixture-employee",
  "action": "Проверить остатки по кабинету",
  "due_at": "2026-09-15T12:00:00Z",
  "expected_outcome": "Источник остатков приложен к задаче",
  "horizon_days": 3,
  "created_at": "2026-09-13T12:00:00Z"
}
